{
  "schemaVersion": "territorykit-tr-adm3-source-inventory@1",
  "country": "TR",
  "generatedAt": "2026-07-30T00:00:00.000Z",
  "summary": {
    "provinceCount": 81,
    "approvedCount": 4,
    "candidateCount": 3,
    "blockedCount": 74,
    "nationalProductionCatalogChanged": false
  },
  "provinces": [
    {
      "provinceCode": "01",
      "provinceName": "Adana",
      "provider": "NVI MAKS authority path",
      "sourceUrl": "https://maks.nvi.gov.tr/",
      "downloadOrServiceUrl": null,
      "format": null,
      "crs": null,
      "sourceDate": null,
      "license": "not public / unknown",
      "redistributionPermission": "unknown",
      "commercialUsePermission": "unknown",
      "neighbourhoodNameField": null,
      "sourceNativeIdField": null,
      "districtParentField": null,
      "featureCount": null,
      "recommendedAdapter": "authority-export-geojson-property-map",
      "qualityRisk": "No redistributable public provincial polygon package was found; request official MAKS export and license.",
      "status": "requires-authority-request",
      "evidenceUrls": ["https://maks.nvi.gov.tr/"]
    },
    {
      "provinceCode": "02",
      "provinceName": "Adıyaman",
      "provider": "NVI MAKS authority path",
      "sourceUrl": "https://maks.nvi.gov.tr/",
      "downloadOrServiceUrl": null,
      "format": null,
      "crs": null,
      "sourceDate": null,
      "license": "not public / unknown",
      "redistributionPermission": "unknown",
      "commercialUsePermission": "unknown",
      "neighbourhoodNameField": null,
      "sourceNativeIdField": null,
      "districtParentField": null,
      "featureCount": null,
      "recommendedAdapter": "authority-export-geojson-property-map",
      "qualityRisk": "No redistributable public provincial polygon package was found; request official MAKS export and license.",
      "status": "requires-authority-request",
      "evidenceUrls": ["https://maks.nvi.gov.tr/"]
    },
    {
      "provinceCode": "03",
      "provinceName": "Afyonkarahisar",
      "provider": "Afyonkarahisar Belediyesi / ULASAV",
      "sourceUrl": "https://ulasav.csb.gov.tr/dataset/mahalle-listesi-sehir-haritasi",
      "downloadOrServiceUrl": null,
      "format": "PDF/JPEG map",
      "crs": null,
      "sourceDate": null,
      "license": "unknown",
      "redistributionPermission": "unknown",
      "commercialUsePermission": "unknown",
      "neighbourhoodNameField": null,
      "sourceNativeIdField": null,
      "districtParentField": null,
      "featureCount": null,
      "recommendedAdapter": "none-map-image-is-not-adm3-geometry",
      "qualityRisk": "ULASAV result is a rendered map/list, not redistributable vector neighbourhood polygons.",
      "status": "geometry-unavailable",
      "evidenceUrls": [
        "https://ulasav.csb.gov.tr/dataset/?_res_format_limit=0&_tags_limit=0&tags=mahalle"
      ]
    },
    {
      "provinceCode": "04",
      "provinceName": "Ağrı",
      "provider": "NVI MAKS authority path",
      "sourceUrl": "https://maks.nvi.gov.tr/",
      "downloadOrServiceUrl": null,
      "format": null,
      "crs": null,
      "sourceDate": null,
      "license": "not public / unknown",
      "redistributionPermission": "unknown",
      "commercialUsePermission": "unknown",
      "neighbourhoodNameField": null,
      "sourceNativeIdField": null,
      "districtParentField": null,
      "featureCount": null,
      "recommendedAdapter": "authority-export-geojson-property-map",
      "qualityRisk": "No redistributable public provincial polygon package was found; request official MAKS export and license.",
      "status": "requires-authority-request",
      "evidenceUrls": ["https://maks.nvi.gov.tr/"]
    },
    {
      "provinceCode": "05",
      "provinceName": "Amasya",
      "provider": "NVI MAKS authority path",
      "sourceUrl": "https://maks.nvi.gov.tr/",
      "downloadOrServiceUrl": null,
      "format": null,
      "crs": null,
      "sourceDate": null,
      "license": "not public / unknown",
      "redistributionPermission": "unknown",
      "commercialUsePermission": "unknown",
      "neighbourhoodNameField": null,
      "sourceNativeIdField": null,
      "districtParentField": null,
      "featureCount": null,
      "recommendedAdapter": "authority-export-geojson-property-map",
      "qualityRisk": "No redistributable public provincial polygon package was found; request official MAKS export and license.",
      "status": "requires-authority-request",
      "evidenceUrls": ["https://maks.nvi.gov.tr/"]
    },
    {
      "provinceCode": "06",
      "provinceName": "Ankara",
      "provider": "Ankara Büyükşehir Belediyesi ASKI ArcGIS planning service",
      "sourceUrl": "https://planaski.ankara.bel.tr/webgis/rest/services/askidan_inen_planlar/askiTum_inen/MapServer/420",
      "downloadOrServiceUrl": "https://planaski.ankara.bel.tr/webgis/rest/services/askidan_inen_planlar/askiTum_inen/MapServer/420/query",
      "format": "ArcGIS MapServer",
      "crs": null,
      "sourceDate": null,
      "license": "unknown",
      "redistributionPermission": "unknown",
      "commercialUsePermission": "unknown",
      "neighbourhoodNameField": "adinumarasi",
      "sourceNativeIdField": null,
      "districtParentField": null,
      "featureCount": null,
      "recommendedAdapter": "arcgis-feature-service-blocked",
      "qualityRisk": "Search index shows a Mahalle Siniri layer, but live REST requests returned service-not-found errors.",
      "status": "access-blocked",
      "evidenceUrls": [
        "https://planaski.ankara.bel.tr/webgis/rest/services/askidan_inen_planlar/askiTum_inen/MapServer/420"
      ]
    },
    {
      "provinceCode": "07",
      "provinceName": "Antalya",
      "provider": "NVI MAKS authority path",
      "sourceUrl": "https://maks.nvi.gov.tr/",
      "downloadOrServiceUrl": null,
      "format": null,
      "crs": null,
      "sourceDate": null,
      "license": "not public / unknown",
      "redistributionPermission": "unknown",
      "commercialUsePermission": "unknown",
      "neighbourhoodNameField": null,
      "sourceNativeIdField": null,
      "districtParentField": null,
      "featureCount": null,
      "recommendedAdapter": "authority-export-geojson-property-map",
      "qualityRisk": "No redistributable public provincial polygon package was found; request official MAKS export and license.",
      "status": "requires-authority-request",
      "evidenceUrls": ["https://maks.nvi.gov.tr/"]
    },
    {
      "provinceCode": "08",
      "provinceName": "Artvin",
      "provider": "Artvin Il Ozel Idaresi ArcGIS service",
      "sourceUrl": "https://cbs.artvinozelidare.gov.tr/servergis/rest/services/IDARE_PUBLIC/IMAR_PUBLIC/FeatureServer/1838",
      "downloadOrServiceUrl": "https://cbs.artvinozelidare.gov.tr/servergis/rest/services/IDARE_PUBLIC/IMAR_PUBLIC/FeatureServer/1838/query",
      "format": "ArcGIS FeatureServer",
      "crs": null,
      "sourceDate": null,
      "license": "unknown",
      "redistributionPermission": "unknown",
      "commercialUsePermission": "unknown",
      "neighbourhoodNameField": "ADI",
      "sourceNativeIdField": null,
      "districtParentField": null,
      "featureCount": null,
      "recommendedAdapter": "arcgis-feature-service-blocked",
      "qualityRisk": "Search index shows a public Mahalle Siniri layer, but live service requests returned empty/404 responses.",
      "status": "access-blocked",
      "evidenceUrls": [
        "https://cbs.artvinozelidare.gov.tr/servergis/rest/services/IDARE_PUBLIC/IMAR_PUBLIC/FeatureServer/1838"
      ]
    },
    {
      "provinceCode": "09",
      "provinceName": "Aydın",
      "provider": "NVI MAKS authority path",
      "sourceUrl": "https://maks.nvi.gov.tr/",
      "downloadOrServiceUrl": null,
      "format": null,
      "crs": null,
      "sourceDate": null,
      "license": "not public / unknown",
      "redistributionPermission": "unknown",
      "commercialUsePermission": "unknown",
      "neighbourhoodNameField": null,
      "sourceNativeIdField": null,
      "districtParentField": null,
      "featureCount": null,
      "recommendedAdapter": "authority-export-geojson-property-map",
      "qualityRisk": "No redistributable public provincial polygon package was found; request official MAKS export and license.",
      "status": "requires-authority-request",
      "evidenceUrls": ["https://maks.nvi.gov.tr/"]
    },
    {
      "provinceCode": "10",
      "provinceName": "Balıkesir",
      "provider": "NVI MAKS authority path",
      "sourceUrl": "https://maks.nvi.gov.tr/",
      "downloadOrServiceUrl": null,
      "format": null,
      "crs": null,
      "sourceDate": null,
      "license": "not public / unknown",
      "redistributionPermission": "unknown",
      "commercialUsePermission": "unknown",
      "neighbourhoodNameField": null,
      "sourceNativeIdField": null,
      "districtParentField": null,
      "featureCount": null,
      "recommendedAdapter": "authority-export-geojson-property-map",
      "qualityRisk": "No redistributable public provincial polygon package was found; request official MAKS export and license.",
      "status": "requires-authority-request",
      "evidenceUrls": ["https://maks.nvi.gov.tr/"]
    },
    {
      "provinceCode": "11",
      "provinceName": "Bilecik",
      "provider": "NVI MAKS authority path",
      "sourceUrl": "https://maks.nvi.gov.tr/",
      "downloadOrServiceUrl": null,
      "format": null,
      "crs": null,
      "sourceDate": null,
      "license": "not public / unknown",
      "redistributionPermission": "unknown",
      "commercialUsePermission": "unknown",
      "neighbourhoodNameField": null,
      "sourceNativeIdField": null,
      "districtParentField": null,
      "featureCount": null,
      "recommendedAdapter": "authority-export-geojson-property-map",